{
  "$schema": "https://json-schema.org/draft/2020-12/schema",
  "$id": "https://x2knwldg.local/schemas/synthesis/v1/source_knowledge.schema.json",
  "title": "Source knowledge (v1)",
  "description": "One readable, derived account of one acquired source, written as output/<run-id>/source_knowledge.json after extraction, normalization, relationship extraction and the coverage audit. It is knowledge, not evidence: every narrative statement names the knowledge units it rests on, evidence excerpts stay in those units and are never copied here, and the record cannot claim a status stronger than the run it describes. Frozen by T-251; the apply gate, the validators and the adapter projection are T-252. A missing artifact is an honest 'unavailable' brief, never an empty successful one.",
  "type": "object",
  "required": [
    "schema_version",
    "source_id",
    "status",
    "thesis",
    "key_points",
    "limitations_or_tensions",
    "generated_from"
  ],
  "additionalProperties": false,
  "properties": {
    "schema_version": { "$ref": "primitives.schema.json#/$defs/schemaVersion" },
    "source_id": {
      "description": "The source this brief accounts for. The apply gate additionally checks it against the run it is being written into: a brief carrying another source's id would attach one source's account to another's evidence, and JSON Schema cannot compare a document with its own location.",
      "$ref": "primitives.schema.json#/$defs/sourceId"
    },
    "status": {
      "description": "The status of the underlying run, copied. Never computed here and never raised: a brief derived from a PARTIAL run is visibly partial, and the validator refuses a status stronger than validation.json states (D-246).",
      "$ref": "primitives.schema.json#/$defs/runStatus"
    },
    "thesis": {
      "description": "The source's central claim, in Persian, in one statement.",
      "$ref": "source_knowledge.schema.json#/$defs/supportedStatement"
    },
    "key_points": {
      "description": "The points a reader needs, in the order they should be read. At least one: a brief with a thesis and nothing under it is a title, and the Source Map card has a section for these.",
      "type": "array",
      "minItems": 1,
      "uniqueItems": true,
      "items": { "$ref": "source_knowledge.schema.json#/$defs/identifiedStatement" }
    },
    "limitations_or_tensions": {
      "description": "What the source leaves unresolved, contradicts itself about, or does not establish. May be empty — an empty array here says 'none recorded', which is a claim the generator is allowed to make; it is not the same as the field being absent, which is why the field is required and the array is not.",
      "type": "array",
      "uniqueItems": true,
      "items": { "$ref": "source_knowledge.schema.json#/$defs/identifiedStatement" }
    },
    "generated_from": {
      "description": "Digests of the canonical inputs this brief was generated from, so staleness is detectable rather than assumed. A digest that no longer matches the file means the brief describes a run that has since changed, and the reader is told rather than shown an account of something else.",
      "type": "object",
      "required": [
        "knowledge_units_sha256",
        "relationships_sha256",
        "coverage_sha256"
      ],
      "additionalProperties": false,
      "properties": {
        "knowledge_units_sha256": { "$ref": "primitives.schema.json#/$defs/sha256" },
        "relationships_sha256": { "$ref": "primitives.schema.json#/$defs/sha256" },
        "coverage_sha256": { "$ref": "primitives.schema.json#/$defs/sha256" }
      }
    },
    "generated_at": {
      "description": "When the brief was generated. Optional, and never a substitute for the digests: a timestamp says when, the digests say what from, and only the second can detect staleness.",
      "$ref": "primitives.schema.json#/$defs/isoTimestamp"
    }
  },
  "$defs": {
    "supportedStatement": {
      "description": "A Persian statement and the knowledge units it rests on. The pairing is the contract: a statement with no support is an assertion the source never made, and support naming units the run does not hold is worse, because it looks checkable and is not. The second condition needs the run's own unit list and is checked by the apply gate.",
      "type": "object",
      "required": ["content", "based_on"],
      "additionalProperties": false,
      "properties": {
        "content": { "$ref": "primitives.schema.json#/$defs/narrativeText" },
        "based_on": { "$ref": "primitives.schema.json#/$defs/supportList" }
      }
    },
    "identifiedStatement": {
      "description": "A supported statement that is addressable — the UI links to one, and a later revision has to be able to say which point it changed. Ids are unique within their list; JSON Schema can require the whole objects to differ but cannot compare one field across array members, so the duplicate-id case is a validator rule and a committed invalid fixture.",
      "type": "object",
      "required": ["id", "content", "based_on"],
      "additionalProperties": false,
      "properties": {
        "id": {
          "$comment": "SP for 'source point'. Numbered rather than hashed: these are ordered, human-readable and quoted in a card, and a digest would make a reordering look like a rewrite.",
          "type": "string",
          "pattern": "^SP-[0-9]{3,6}$"
        },
        "content": { "$ref": "primitives.schema.json#/$defs/narrativeText" },
        "based_on": { "$ref": "primitives.schema.json#/$defs/supportList" }
      }
    }
  }
}
